{
  "$schema": "../../schema/compare.schema.json",
  "version": 1,
  "generatedAt": "2026-09-24T16:30:33.202Z",
  "currency": "EUR",
  "vat": "excluded",
  "note": "buy/sell exclude VAT, energy tax (energiebelasting) and grid costs. Add those for an all-in consumer price.",
  "today": {
    "date": "2026-09-24",
    "electricitySource": "energyzero",
    "gasMarketAverage": 0.715,
    "suppliers": [
      {
        "id": "anwb",
        "name": "ANWB Energie",
        "verified": true,
        "fixedMonthly": {
          "electricity": null,
          "gas": null
        },
        "gasPrice": 0.778471
      },
      {
        "id": "frank",
        "name": "Frank Energie",
        "verified": true,
        "fixedMonthly": {
          "electricity": 5.785124,
          "gas": 5.785124
        },
        "gasPrice": 0.781
      },
      {
        "id": "nextenergy",
        "name": "NextEnergy",
        "verified": true,
        "fixedMonthly": {
          "electricity": 4.950413,
          "gas": 4.950413
        },
        "gasPrice": 0.780289
      },
      {
        "id": "tibber",
        "name": "Tibber",
        "verified": true,
        "fixedMonthly": {
          "electricity": 5.77686,
          "gas": 4.950413
        },
        "gasPrice": 0.788017
      },
      {
        "id": "vattenfall",
        "name": "Vattenfall (FlexPrijs)",
        "verified": true,
        "fixedMonthly": {
          "electricity": null,
          "gas": null
        },
        "gasPrice": null
      }
    ],
    "hours": [
      {
        "start": "2026-09-24T00:00:00+02:00",
        "startUtc": "2026-09-23T22:00:00Z",
        "market": 0.155292,
        "buy": {
          "anwb": 0.170168,
          "frank": 0.170292,
          "nextenergy": 0.172647,
          "tibber": 0.170168,
          "vattenfall": null
        },
        "sell": {
          "anwb": 0.155292,
          "frank": 0.144792,
          "nextenergy": 0.155292,
          "tibber": 0.140416,
          "vattenfall": 0.155292
        }
      },
      {
        "start": "2026-09-24T01:00:00+02:00",
        "startUtc": "2026-09-23T23:00:00Z",
        "market": 0.152602,
        "buy": {
          "anwb": 0.167478,
          "frank": 0.167602,
          "nextenergy": 0.169957,
          "tibber": 0.167478,
          "vattenfall": null
        },
        "sell": {
          "anwb": 0.152602,
          "frank": 0.142102,
          "nextenergy": 0.152602,
          "tibber": 0.137726,
          "vattenfall": 0.152602
        }
      },
      {
        "start": "2026-09-24T02:00:00+02:00",
        "startUtc": "2026-09-24T00:00:00Z",
        "market": 0.13039,
        "buy": {
          "anwb": 0.145266,
          "frank": 0.14539,
          "nextenergy": 0.147745,
          "tibber": 0.145266,
          "vattenfall": null
        },
        "sell": {
          "anwb": 0.13039,
          "frank": 0.11989,
          "nextenergy": 0.13039,
          "tibber": 0.115514,
          "vattenfall": 0.13039
        }
      },
      {
        "start": "2026-09-24T03:00:00+02:00",
        "startUtc": "2026-09-24T01:00:00Z",
        "market": 0.153123,
        "buy": {
          "anwb": 0.167999,
          "frank": 0.168123,
          "nextenergy": 0.170478,
          "tibber": 0.167999,
          "vattenfall": null
        },
        "sell": {
          "anwb": 0.153123,
          "frank": 0.142623,
          "nextenergy": 0.153123,
          "tibber": 0.138247,
          "vattenfall": 0.153123
        }
      },
      {
        "start": "2026-09-24T04:00:00+02:00",
        "startUtc": "2026-09-24T02:00:00Z",
        "market": 0.153952,
        "buy": {
          "anwb": 0.168828,
          "frank": 0.168952,
          "nextenergy": 0.171307,
          "tibber": 0.168828,
          "vattenfall": null
        },
        "sell": {
          "anwb": 0.153952,
          "frank": 0.143452,
          "nextenergy": 0.153952,
          "tibber": 0.139076,
          "vattenfall": 0.153952
        }
      },
      {
        "start": "2026-09-24T05:00:00+02:00",
        "startUtc": "2026-09-24T03:00:00Z",
        "market": 0.158365,
        "buy": {
          "anwb": 0.173241,
          "frank": 0.173365,
          "nextenergy": 0.17572,
          "tibber": 0.173241,
          "vattenfall": null
        },
        "sell": {
          "anwb": 0.158365,
          "frank": 0.147865,
          "nextenergy": 0.158365,
          "tibber": 0.143489,
          "vattenfall": 0.158365
        }
      },
      {
        "start": "2026-09-24T06:00:00+02:00",
        "startUtc": "2026-09-24T04:00:00Z",
        "market": 0.17356,
        "buy": {
          "anwb": 0.188436,
          "frank": 0.18856,
          "nextenergy": 0.190915,
          "tibber": 0.188436,
          "vattenfall": null
        },
        "sell": {
          "anwb": 0.17356,
          "frank": 0.16306,
          "nextenergy": 0.17356,
          "tibber": 0.158684,
          "vattenfall": 0.17356
        }
      },
      {
        "start": "2026-09-24T07:00:00+02:00",
        "startUtc": "2026-09-24T05:00:00Z",
        "market": 0.218002,
        "buy": {
          "anwb": 0.232878,
          "frank": 0.233002,
          "nextenergy": 0.235357,
          "tibber": 0.232878,
          "vattenfall": null
        },
        "sell": {
          "anwb": 0.218002,
          "frank": 0.207502,
          "nextenergy": 0.218002,
          "tibber": 0.203126,
          "vattenfall": 0.218002
        }
      },
      {
        "start": "2026-09-24T08:00:00+02:00",
        "startUtc": "2026-09-24T06:00:00Z",
        "market": 0.206477,
        "buy": {
          "anwb": 0.221353,
          "frank": 0.221477,
          "nextenergy": 0.223832,
          "tibber": 0.221353,
          "vattenfall": null
        },
        "sell": {
          "anwb": 0.206477,
          "frank": 0.195977,
          "nextenergy": 0.206477,
          "tibber": 0.191601,
          "vattenfall": 0.206477
        }
      },
      {
        "start": "2026-09-24T09:00:00+02:00",
        "startUtc": "2026-09-24T07:00:00Z",
        "market": 0.161105,
        "buy": {
          "anwb": 0.175981,
          "frank": 0.176105,
          "nextenergy": 0.17846,
          "tibber": 0.175981,
          "vattenfall": null
        },
        "sell": {
          "anwb": 0.161105,
          "frank": 0.150605,
          "nextenergy": 0.161105,
          "tibber": 0.146229,
          "vattenfall": 0.161105
        }
      },
      {
        "start": "2026-09-24T10:00:00+02:00",
        "startUtc": "2026-09-24T08:00:00Z",
        "market": 0.115062,
        "buy": {
          "anwb": 0.129938,
          "frank": 0.130062,
          "nextenergy": 0.132417,
          "tibber": 0.129938,
          "vattenfall": null
        },
        "sell": {
          "anwb": 0.115062,
          "frank": 0.104562,
          "nextenergy": 0.115062,
          "tibber": 0.100186,
          "vattenfall": 0.115062
        }
      },
      {
        "start": "2026-09-24T11:00:00+02:00",
        "startUtc": "2026-09-24T09:00:00Z",
        "market": 0.085245,
        "buy": {
          "anwb": 0.100121,
          "frank": 0.100245,
          "nextenergy": 0.1026,
          "tibber": 0.100121,
          "vattenfall": null
        },
        "sell": {
          "anwb": 0.085245,
          "frank": 0.074745,
          "nextenergy": 0.085245,
          "tibber": 0.070369,
          "vattenfall": 0.085245
        }
      },
      {
        "start": "2026-09-24T12:00:00+02:00",
        "startUtc": "2026-09-24T10:00:00Z",
        "market": 0.052763,
        "buy": {
          "anwb": 0.067639,
          "frank": 0.067763,
          "nextenergy": 0.070118,
          "tibber": 0.067639,
          "vattenfall": null
        },
        "sell": {
          "anwb": 0.052763,
          "frank": 0.042263,
          "nextenergy": 0.052763,
          "tibber": 0.037887,
          "vattenfall": 0.052763
        }
      },
      {
        "start": "2026-09-24T13:00:00+02:00",
        "startUtc": "2026-09-24T11:00:00Z",
        "market": 0.03941,
        "buy": {
          "anwb": 0.054286,
          "frank": 0.05441,
          "nextenergy": 0.056765,
          "tibber": 0.054286,
          "vattenfall": null
        },
        "sell": {
          "anwb": 0.03941,
          "frank": 0.02891,
          "nextenergy": 0.03941,
          "tibber": 0.024534,
          "vattenfall": 0.03941
        }
      },
      {
        "start": "2026-09-24T14:00:00+02:00",
        "startUtc": "2026-09-24T12:00:00Z",
        "market": 0.03903,
        "buy": {
          "anwb": 0.053906,
          "frank": 0.05403,
          "nextenergy": 0.056385,
          "tibber": 0.053906,
          "vattenfall": null
        },
        "sell": {
          "anwb": 0.03903,
          "frank": 0.02853,
          "nextenergy": 0.03903,
          "tibber": 0.024154,
          "vattenfall": 0.03903
        }
      },
      {
        "start": "2026-09-24T15:00:00+02:00",
        "startUtc": "2026-09-24T13:00:00Z",
        "market": 0.079988,
        "buy": {
          "anwb": 0.094864,
          "frank": 0.094988,
          "nextenergy": 0.097343,
          "tibber": 0.094864,
          "vattenfall": null
        },
        "sell": {
          "anwb": 0.079988,
          "frank": 0.069488,
          "nextenergy": 0.079988,
          "tibber": 0.065112,
          "vattenfall": 0.079988
        }
      },
      {
        "start": "2026-09-24T16:00:00+02:00",
        "startUtc": "2026-09-24T14:00:00Z",
        "market": 0.12056,
        "buy": {
          "anwb": 0.135436,
          "frank": 0.13556,
          "nextenergy": 0.137915,
          "tibber": 0.135436,
          "vattenfall": null
        },
        "sell": {
          "anwb": 0.12056,
          "frank": 0.11006,
          "nextenergy": 0.12056,
          "tibber": 0.105684,
          "vattenfall": 0.12056
        }
      },
      {
        "start": "2026-09-24T17:00:00+02:00",